{
  "$schema": "../_schema.json",
  "_metadataVersion": 3,
  "sources": [
    {
      "type": "bunny",
      "bunnyId": "ee2327a5-24a0-402f-97b4-8304a13849c3"
    }
  ],
  "uaid": "s01.e047",
  "season": 1,
  "episode": 47,
  "title": "You Blink You Lose",
  "description": "The eyes are the window into the soul. You better not look away... you might miss something.<br>PEEN ►<a target=\"blank\" href=\"https://youtu.be/553CfZAADag\">https://youtu.be/553CfZAADag</a><br><br>Edited by  ► <a target=\"blank\" href=\"http://www.youtube.com/crankgameplays\">http://www.youtube.com/crankgameplays</a><br><br>This channel, along with every video that has or will ever be uploaded on this channel, will be deleted after our year has ended. This is inevitable. Inescapable. Irreversible.<br>Do not archive or re-upload anything. This is our last wish. Our parting gift. Stay true to the purpose of our final year or we shall lay down wrath upon those that attempt to escape the end.<br><br>Memento Mori.<br>Unus Annus.",
  "releaseDate": 1577732400000
}