{
  "$schema": "../_schema.json",
  "_metadataVersion": 3,
  "sources": [
    {
      "type": "bunny",
      "id": "bunny",
      "bunnyId": "6dbc4ea0-e55b-4ee0-a7e1-5de841931a08"
    }
  ],
  "uaid": "s01.e004",
  "season": 1,
  "episode": 4,
  "title": "Hot Dog’d to Death",
  "description": "The boys chase their dreams of joining Joey Chestnut in the MLE hall of fame.<br><br>Edited by Amy ► <a target=\"blank\" href=\"https://twitter.com/iceddarkroast\">https://twitter.com/iceddarkroast</a><br><br>This channel, along with every video that has or will ever be uploaded on this channel, will be deleted after our year has ended. This is inevitable. Inescapable. Irreversible.<br>Do not archive or re-upload anything. This is our last wish. Our parting gift. Stay true to the purpose of our final year or we shall lay down wrath upon those that attempt to escape the end.<br><br>Memento Mori.<br>Unus Annus.",
  "releaseDate": 1574017200000
}
