{
  "$schema": "../_schema.json",
  "_metadataVersion": 3,
  "sources": [
    {
      "type": "bunny",
      "id": "bunny",
      "bunnyId": "70f1b31a-f801-4d77-945a-e51414437bf0"
    }
  ],
  "uaid": "s01.e065",
  "season": 1,
  "episode": 65,
  "title": "2 Absolute Beginners Experience the Dancing Glory that is Salsa",
  "description": "Salsa is the ancient art of dance whereby the dancers express thoughts and emotions through the undulations of their hips. We attempt to learn the mysterious ways of this sanctified dance.<br><br>Edited By â–º <a target=\"blank\" href=\"https://www.youtube.com/LixianTV\">https://www.youtube.com/LixianTV</a><br><br>This channel, along with every video that has or will ever be uploaded on this channel, will be deleted after our year has ended. This is inevitable. Inescapable. Irreversible.<br>Do not archive or re-upload anything. This is our last wish. Our parting gift. Stay true to the purpose of our final year or we shall lay down wrath upon those that attempt to escape the end.<br><br>Memento Mori.<br>Unus Annus.",
  "releaseDate": 1579287600000
}
