{
  "$schema": "../_schema.json",
  "_metadataVersion": 3,
  "sources": [
    {
      "type": "bunny",
      "id": "bunny",
      "bunnyId": "38b283f6-2a7e-41e2-b5c4-8b0a9f1ad085"
    }
  ],
  "uaid": "s01.e085",
  "season": 1,
  "episode": 85,
  "title": "Literally Eating Fire ",
  "description": "Yes, you read that right. Mark and Ethan learn how to literally eat fire. Don't try this at home.",
  "releaseDate": 1581015600000
}
