{
  "$schema": "../_schema.json",
  "_metadataVersion": 3,
  "sources": [
    {
      "type": "bunny",
      "bunnyId": "cfbea560-eedb-4ca3-a9ac-de4234805305"
    }
  ],
  "uaid": "s01.e011",
  "season": 1,
  "episode": 11,
  "title": "Baby Hands Operation",
  "description": "Mark and Ethan strap on their baby hands and get straight to their most important job: Saving lives.<br><br>Edited by Ethan â–º <a target=\"blank\" href=\"https://www.youtube.com/channel/UC2S7CGceq5tsuhcVyACdA3g\">https://www.youtube.com/channel/UC2S7CGceq5tsuhcVyACdA3g</a><br><br>This channel, along with every video that has or will ever be uploaded on this channel, will be deleted after our year has ended. This is inevitable. Inescapable. Irreversible.<br>Do not archive or re-upload anything. This is our last wish. Our parting gift. Stay true to the purpose of our final year or we shall lay down wrath upon those that attempt to escape the end.<br><br>Memento Mori.<br>Unus Annus.",
  "releaseDate": 1574622000000
}