{
  "$schema": "../_schema.json",
  "_metadataVersion": 3,
  "sources": [
    {
      "type": "bunny",
      "id": "bunny",
      "bunnyId": "3ad53ce0-2b0b-41cd-a3c3-2bd744f94c02"
    }
  ],
  "uaid": "s01.e006",
  "season": 1,
  "episode": 6,
  "title": "The Good Kind of Cupping ðŸ™‚",
  "description": "Speed Cup Stacking is a time honored tradition enjoyed by thousands across the globe. Mark and Ethan attempt to learn the ways of the cup to see if they can compete in the global cup arena.<br>The Winner â–º <a target=\"blank\" href=\"https://www.youtube.com/channel/UCaFmoZOqvJuhMy2aZJ8rOMw\">https://www.youtube.com/channel/UCaFmoZOqvJuhMy2aZJ8rOMw</a><br><br>Edited by Amy â–º <a target=\"blank\" href=\"https://twitter.com/iceddarkroast\">https://twitter.com/iceddarkroast</a><br><br>This channel, along with every video that has or will ever be uploaded on this channel, will be deleted after our year has ended. This is inevitable. Inescapable. Irreversible.<br>Do not archive or re-upload anything. This is our last wish. Our parting gift. Stay true to the purpose of our final year or we shall lay down wrath upon those that attempt to escape the end.<br><br>Memento Mori.<br>Unus Annus.",
  "releaseDate": 1574190000000
}
