{
  "$schema": "../_schema.json",
  "_metadataVersion": 3,
  "sources": [
    {
      "type": "bunny",
      "id": "bunny",
      "bunnyId": "8a2e1f7e-4bf1-453b-8409-e6c67eb06d95"
    }
  ],
  "uaid": "s01.e033",
  "season": 1,
  "episode": 33,
  "title": "We Had To Drink Each Other’s Pee",
  "description": "Through the power of the Life Straw, Ethan and Mark taste each other's urine.<br><br>Edited by  ► <a target=\"blank\" href=\"http://www.youtube.com/crankgameplays\">http://www.youtube.com/crankgameplays</a><br><br>This channel, along with every video that has or will ever be uploaded on this channel, will be deleted after our year has ended. This is inevitable. Inescapable. Irreversible.<br>Do not archive or re-upload anything. This is our last wish. Our parting gift. Stay true to the purpose of our final year or we shall lay down wrath upon those that attempt to escape the end.<br><br>Memento Mori.<br>Unus Annus.",
  "releaseDate": 1576522800000
}
