{
  "$schema": "../_schema.json",
  "_metadataVersion": 3,
  "sources": [
    {
      "type": "bunny",
      "id": "bunny",
      "bunnyId": "7c09c0b3-7a88-4779-bd5b-8ff956346dae"
    }
  ],
  "uaid": "s01.e064",
  "season": 1,
  "episode": 64,
  "title": "You Breathe You Die",
  "description": "The rules are simple: You Breathe, You Die.<br><br>Edited by  â–º <a target=\"blank\" href=\"https://bit.ly/2Mv5aTM\">https://bit.ly/2Mv5aTM</a><br><br>This channel, along with every video that has or will ever be uploaded on this channel, will be deleted after our year has ended. This is inevitable. Inescapable. Irreversible.<br>Do not archive or re-upload anything. This is our last wish. Our parting gift. Stay true to the purpose of our final year or we shall lay down wrath upon those that attempt to escape the end.<br><br>Memento Mori.<br>Unus Annus.",
  "releaseDate": 1579201200000
}
