{
  "$schema": "../_schema.json",
  "_metadataVersion": 3,
  "sources": [
    {
      "type": "bunny",
      "id": "bunny",
      "bunnyId": "9558f394-b118-4293-816e-cf09c03bd4a9"
    }
  ],
  "uaid": "s01.e190",
  "season": 1,
  "episode": 190,
  "title": "Harnessing Our Yodeling Power to End The World As We Know It",
  "description": "You hear that? Off in the distance? That, my friends, is the sound of two gods screaming into the ether. It is the first sound in the morning and the last sound at night. It is the call to end all calls. It is... THE YODEL.",
  "releaseDate": 1590087600000
}
